ResponseId,StartDate,Q1,Q2,Q3,Q4,notes
gzgwkjgkoa,2020-02-07,exceeded expectations,substantial increase,collaborative Developing flows work producible,"I create RMarkdown, NSF. a management and the GitHub, many etc. to was using have I collaborative implement Data these plan KNB, how of expected written for plan. management R, What was tools",NA
trmoyxzrzy,2020-02-07,exceeded expectations,substantial increase,maps and are make How leaflet in do R you to visualization in can GGplot the and graphs - that mindblowing.,went functions packages - the to expand tough those of The spend utility and follow were over time and and creating quickly more lessons with the,NA
qqycjmwyxp,2020-02-07,met expectations,no change,r-package Creating,,NA
csgofoaiuz,2018-08-17,exceeded expectations,substantial increase,"OpenR) Github and with GitHub creating (twitter, planning - learned were Rmarkdown - Several - very - - colleagues descriptions data and metadata the management using I networked useful Using valuable, communities R community, Git items many from including: - R, the",experienced) larger back some less (come as as additional partners more working the future: get that with following quickly learned covered like topics at breakout practice any what in or can can resolved discuss additional especially end - the to of - more with a - to go move sessions extra (maybe we the experienced in for a would sessions issues the so and additional R handouts how during time time refresher/reminder over we see groups hands-on and we to them) through I we practice changed of so group sessions,NA
jdnhlanepo,2018-08-17,1,increase,and valuable the arctic learning The of with data of was repositories. workshop one data most interacting center the immediately and portion,"overall This affect I I times one individually. express often to questions experience, opportunity discussion see concerns, or talked did with help ideas, during my was have feeling on as learning to I I and experimented over. able one wither not my that did was Many solutions felt the or not",NA
eloeghoodu,2018-08-17,1,substantial increase,"git RMarkdown, The instructions. and GitHub related skills and",R for have I everything here. is users and useful think workshop opportunity this learned good a I is very,NA
ymlaqyyueg,2018-08-17,just above expectations,substantial increase,"would can the These Besides write and increase data writing able and the proposals manipulation, other with plans, academic to management data websites, and manuscripts, collaboration ease multi-purpose tools creating research users. Git production. being the","For having paper-copy be be the learners, terms taught of may and might will next handout taking example keeping be notes. of what R records useful Brief day a in helpful. new",NA
ykvfyyeptl,2018-08-17,met expectations,increase,community possible create is it supportive science a to,May practical you be a of workshop should part expand the,NA
rggbgomiqp,2018-08-17,just above expectations,increase,"of aspects plan R some management tools, data programming","can visualization. and publishing, time tutorial R to data be intro lessons. statistics, paper and programming workshop. homework must online the to inexperienced The for on people before provide shortened analysis, You Spend data more 2-3 and management",NA
hxrknosmal,2018-08-17,just above expectations,substantial increase,having center being data also I later. the to on more all value various them The and and refer in with to liked able of Arctic materials its line the R working help features. and,"help, the use some sure by we that future limit address questions try lessons times during Perhaps all that might so problem, that as I'm implement we from and might it it difficult to participants community future a answer participants. would can creating that the user learned concern group but is that come sessions. extremely to a have how R the biggest training not to my up we use is the program this",NA
cmatwmczzs,2018-08-17,exceeded expectations,substantial increase,RStudio and applications RMarkup,"I increasingly where covered like would work advantageous working with we this tackle to tasks? workshop, spatial are R see data them. I'd processing. If spatial of (ArcPy, to context so, Python instances there working Python be with in what for SciPy) the with In some to",NA
wweikmbutn,2018-08-17,exceeded expectations,substantial increase,and R increased and understanding in Additional proficiency R packages,"relative to web do template, it Tool. We workshop. provides and could the the interface my discussed not improved. It useful was a position currently be but so ways during The",NA
kfmwekozvy,2018-08-17,exceeded expectations,slight increase,and Git and them about R how with to Learned work,relevant were group of group May could sessions would not always be split the sessions practice be from more for beneficial audience Smaller questions A that lot,NA
whseegyjun,2018-08-17,met expectations,no change,forward taking Introduction am RStudio. to and and in to looking gaining RStudio. courses enthusiastically & R I R more instruction,pages discussion. from the Data much project did Center Arctic gain I,NA
cbcvrwjqtj,2018-08-17,exceeded expectations,substantial increase,Git! to use How,html include people created it all helpful R the (minor offerings of be that for we some for chapters. to For the future could thing),NA
owtphenlap,2018-08-17,exceeded expectations,substantial increase,"capabilities, data practice Data plan Overall management practices, Center; with of GitHub and Arctic DMPTool, Rstudio philosophy, development the resources","to wait and our and kind sitting be been We late happy to Loved play Wednesday sit all Would afternoon sets hours some was skills? have much data informal had ask hours it to to drag. had for then work day then the of them almost bring dinner. dinner and with, much and more. feasible an 2 lovely with use appreciated to but participants a",NA
idjvkossjl,2018-08-17,exceeded expectations,substantial increase,GitHub R of Possibilities and,,NA
dnkdcomhos,2018-08-17,exceeded expectations,substantial increase,"strategies data benefits data effective effective behind implement management manipulate data management, and new procedures, tools to to present",great All was,NA
okfyvemqdd,2018-08-17,met expectations,substantial Increase,R and me. coding using Learning for related Git is extremely useful work,"Data that is believe To others who data very but interested me, for interest I important Arctic Center big submission not on. to is",NA
bjfuswzphw,2018-08-17,met expectations,substantial increase,was Hearing The most provided other's questions have. enlightening. by materials the the could answers insights more and far than reading the simply gave Q&A me,room. was was noise up. missed lecture difficult to some or I the because manage At in neighbor I to it times a helping catch trying distracted was,NA
wlscmkills,2018-08-17,exceeded expectations,substantial Increase,reproducible stuff neat and implementation. research to make Lots How of the,pace at but high too Bit some even was managable points the then,NA
bqnljsfwtc,2018-08-17,met expectations,slight increase,R the from to Getting markdown. scripts to mode in switch R,"would a one function, my or would so frustrated a the One home dataset like challenge have data an I us thing copy other work write in see another r I more deal single force have replace with manipulate would you have uproducable I do combine in Or using it It dataset NAs. need in to we us through get is of helpful so that been with and would class that to but given. a where experience a be is to to and apply with test one. take way biggest don't to and tools something or to using blocks help exercise getting night that. Excel than to a small one",NA